{
  "id": "f1a2b3c4-d5e6-4789-f012-3456789abcde",
  "objective": "Become the preferred billing platform for LATAM SaaS startups.",
  "key_results": [
    {
      "name": "Active paying customers",
      "unit": "customers",
      "baseline": 420,
      "target": 700,
      "current": 512,
      "score": 0.33
    },
    {
      "name": "Monthly recurring revenue",
      "unit": "USD",
      "baseline": 180000,
      "target": 320000,
      "current": 215000,
      "score": 0.25
    },
    {
      "name": "Net Promoter Score",
      "unit": "NPS",
      "baseline": 48,
      "target": 65,
      "current": 54,
      "score": 0.35
    }
  ],
  "period": "2026-Q2",
  "commitment": "committed",
  "owner_id": "c1d2e3f4-a5b6-4789-c012-3456789abcde",
  "company_id": "a1b2c3d4-e5f6-4789-a012-3456789abcde",
  "brand_id": null,
  "squad_id": null,
  "state": "active",
  "close_outcome": null,
  "score": null,
  "contributing_factory_ids": [],
  "contributing_project_ids": [],
  "contributing_squad_ids": ["e1f2a3b4-c5d6-4789-e012-3456789abcde"],
  "created_at": "2026-03-28T10:00:00Z",
  "updated_at": "2026-04-19T10:00:00Z"
}
